{"table":{"code":"12511-0006","label":{"de":"Einbürgerungen von Ausländern: Deutschland, Jahre,\nLändergruppierungen/Staatsangehörigkeit, Geschlecht,\nEinbürgerungsart, Rechtsgrundlagen","en":"Naturalisation of foreigners: Germany, years,\ncountry groups/citizenship, sex, type of naturalisation,\nlegal basis","wiki":false},"lastChange":"2025-06-03T11:06:52.773Z","copyright":{"de":"© Statistisches Bundesamt (Destatis), 2025","en":"© Statistisches Bundesamt (Destatis), 2025","wiki":false},"license":{"de":"Statistisches Bundesamt, Wiesbaden","en":"Federal Statistical office, Wiesbaden","wiki":false},"note":null,"topnote":null,"reloadStructureOnDataChange":true},"statistics":{"12511":{"label":{"de":"Einbürgerungsstatistik","en":"Naturalisation statistics","wiki":false},"definitionAvailable":true}},"variables":{"STAAG6":{"variableType":"SUBJECT_CLASSIFYING","definitionAvailable":true,"label":{"de":"Staatsangehörigkeit","en":"Citizenship","wiki":false},"breakdownType":"OF_WHICH","variableValues":["%TOTAL%","ST287","ST274","ST225","ST423","ST121","ST221","ST123","ST223","ST320","ST323","ST422","ST425","ST523","ST324","ST424","ST460","ST322","ST169","ST124","ST330","ST229","ST426","ST326","ST122","ST227","ST327","ST185","ST429","ST125","ST258","ST291","ST242","ST332","ST479","ST334","ST231","ST126","ST333","ST335","ST230","ST336","ST337","ST224","ST127","ST281","ST526","ST128","ST129","ST236","ST237","ST430","ST238","ST340","ST134","ST345","ST261","ST259","ST328","ST346","ST347","ST411","ST436","ST437","ST438","ST439","ST135","ST136","ST441","ST137","ST355","ST442","ST421","ST445","ST120","ST138","ST446","ST262","ST348","ST444","ST447","ST243","ST450","ST530","ST349","ST244","ST246","ST245","ST434","ST467","ST150","ST130","ST351","ST448","ST449","ST226","ST139","ST451","ST247","ST248","ST141","ST142","ST143","ST412","ST249","ST256","ST482","ST454","ST251","ST145","ST252","ST544","ST239","ST253","ST353","ST545","ST146","ST147","ST457","ST140","ST254","ST427","ST267","ST531","ST458","ST536","ST354","ST148","ST255","ST232","ST144","ST149","ST151","ST456","ST461","ST459","ST537","ST357","ST538","ST359","ST361","ST462","ST152","ST153","ST265","ST154","ST160","ST524","ST257","ST543","ST156","ST268","ST472","ST157","ST158","ST269","ST170","ST133","ST132","ST271","ST272","ST233","ST474","ST155","ST131","ST273","ST159","ST161","ST431","ST370","ST366","ST369","ST276","ST277","ST278","ST263","ST364","ST475","ST470","ST465","ST282","ST476","ST483","ST283","ST541","ST371","ST284","ST164","ST162","ST163","ST285","ST471","ST540","ST286","ST166","ST165","ST365","ST477","ST532","ST167","ST367","ST469","ST368","ST168","ST432","ST289","ST181","ST997","STAAT900"],"selectedValues":[],"summable":false},"JAHR":{"variableType":"TIME_IDENTIFYING_YEAR","definitionAvailable":false,"label":{"de":"Jahr","en":"Year","wiki":false},"breakdownType":"UNDEF","variableValues":["2000","2001","2002","2003","2004","2005","2006","2007","2008","2009","2010","2011","2012","2013","2014","2015","2016","2017","2018","2019","2020","2021","2022","2023"],"selectedValues":[],"summable":false},"GES":{"variableType":"SUBJECT_CLASSIFYING","definitionAvailable":false,"label":{"de":"Geschlecht","en":"Sex","wiki":false},"breakdownType":"OF_WHICH","variableValues":["GESM","GESW","%TOTAL%"],"selectedValues":[],"summable":false},"BEVEB1":{"variableType":"SUBJECT_CLASSIFYING","definitionAvailable":false,"label":{"de":"Einbürgerungsart","en":"Type of naturalisation","wiki":false},"breakdownType":"OF_WHICH","variableValues":["EINBUERG01","EINBUERG02"],"selectedValues":[],"summable":false},"RECGL1":{"variableType":"SUBJECT_CLASSIFYING","definitionAvailable":false,"label":{"de":"Rechtsgrundlagen","en":"Legal basis","wiki":false},"breakdownType":"OF_WHICH","variableValues":["RECS-10-1","RECS-10-2","RECS-8","RECS-9","RECS-40B","RECR-11","RECR-12-1","RECS-13","RECS-14","RECS-10-3","RECS-10-3-1","RECS-10-3-2","RECG-116-2-1","RECR-9","RECH-21","RECV-2","RECS-40C","RECA-85-1","RECA-85-2","RECA-85ALT","RECA-86-1ALT","RECA-86-2ALT","RECR-8","RECR-9-1","RECR-9-2","RECS-15ALT","RECR1-6","RECRS-8","RECRS-9","RECS-16-2","RECS-15","REC-SONST-ALT"],"selectedValues":[],"summable":false},"LDRGR1":{"variableType":"SUBJECT_CLASSIFYING","definitionAvailable":true,"label":{"de":"Ländergruppierungen","en":"Country groups","wiki":false},"breakdownType":"VIDELICET","variableValues":["%TOTAL%","EUROPA","EUROPA-EU-27-1","DRITT-EU-27-1","EUROPA-EU-28","DRITT-EU-28","EUROPA-EU-27","DRITT-EU-27","EUROPA-EU-25","DRITT-EU-25","EUROPA-EU-15","DRITT-EU-15","EUROPA-EG-12","DRITT-EG-12","EUROPA-EG-10","DRITT-EG-10","EUROPA-EG-09","DRITT-EG-09","EUROPA-EWG-06","DRITT-EWG-06","AFRIKA","AFRIKANORD","AFRIKAWEST","AFRIKAZENTR","AFRIKAOST","AFRIKASUED","AMERIKA","AMERIKANORD","AMERIKAMIT2","AMERIKASUD","ASIEN","ASIENVOR","ASIENSUED2","ASIENOST2","AUSTRALIEN","LDR-GASTARB","LDR-YU","LDR-SM","LDR-SU","LDR-CZ","LDR-GB"],"selectedValues":[],"summable":false},"DINSG":{"variableType":"REGION_CLASSIFYING","definitionAvailable":false,"label":{"de":"Deutschland insgesamt","en":"Germany","wiki":false},"breakdownType":"OF_WHICH","variableValues":["DG"],"selectedValues":[],"summable":false}},"variableValues":{"AMERIKASUD":{"definitionAvailable":false,"label":{"de":"Südamerika","en":"South America","wiki":false},"classKey":null,"compoundKey":null},"ST287":{"definitionAvailable":false,"label":{"de":"Ägypten","en":"Egypt","wiki":false},"classKey":null,"compoundKey":null},"ST166":{"definitionAvailable":false,"label":{"de":"Ukraine","en":"Ukraine","wiki":false},"classKey":"","compoundKey":null},"ST167":{"definitionAvailable":false,"label":{"de":"Vatikanstadt","en":"Vatican City State","wiki":false},"classKey":"","compoundKey":null},"ST168":{"definitionAvailable":true,"label":{"de":"Vereinigtes Königreich","en":"United Kingdom","wiki":false},"classKey":"","compoundKey":null},"ST289":{"definitionAvailable":false,"label":{"de":"Zentralafrikanische Republik","en":"Central African Republic","wiki":false},"classKey":null,"compoundKey":null},"ST169":{"definitionAvailable":false,"label":{"de":"Belarus","en":"Belarus","wiki":false},"classKey":"","compoundKey":null},"ST281":{"definitionAvailable":true,"label":{"de":"Eswatini","en":"Eswatini","wiki":false},"classKey":"","compoundKey":null},"ST160":{"definitionAvailable":false,"label":{"de":"Russische Föderation","en":"Russian Federation","wiki":false},"classKey":"","compoundKey":null},"ST161":{"definitionAvailable":false,"label":{"de":"Spanien","en":"Spain","wiki":false},"classKey":null,"compoundKey":null},"ST282":{"definitionAvailable":false,"label":{"de":"Tansania","en":"Tanzania","wiki":false},"classKey":null,"compoundKey":null},"ST283":{"definitionAvailable":false,"label":{"de":"Togo","en":"Togo","wiki":false},"classKey":null,"compoundKey":null},"ST162":{"definitionAvailable":false,"label":{"de":"Tschechoslowakei (bis 31.12.1992)","en":"Czechoslovakia (until 1992-12-31)","wiki":false},"classKey":null,"compoundKey":null},"ST284":{"definitionAvailable":false,"label":{"de":"Tschad","en":"Chad","wiki":false},"classKey":null,"compoundKey":null},"ST163":{"definitionAvailable":false,"label":{"de":"Türkei","en":"Turkey","wiki":false},"classKey":null,"compoundKey":null},"ST164":{"definitionAvailable":true,"label":{"de":"Tschechien","en":"Czechia","wiki":false},"classKey":"","compoundKey":null},"ST285":{"definitionAvailable":false,"label":{"de":"Tunesien","en":"Tunisia","wiki":false},"classKey":null,"compoundKey":null},"ST286":{"definitionAvailable":false,"label":{"de":"Uganda","en":"Uganda","wiki":false},"classKey":null,"compoundKey":null},"ST165":{"definitionAvailable":false,"label":{"de":"Ungarn","en":"Hungary","wiki":false},"classKey":null,"compoundKey":null},"EUROPA-EU-27-1":{"definitionAvailable":true,"label":{"de":"EU-27 (seit 01.02.2020)","en":"EU-27 (since 2020-02-01)","wiki":false},"classKey":"","compoundKey":null},"RECA-85ALT":{"definitionAvailable":true,"label":{"de":"§85 AuslG, alte Fass., junge Ausländer (bis 2004)","en":"S.85FA,old v.,entitl.to nat.young foreig. (u.2004)","wiki":false},"classKey":null,"compoundKey":null},"RECS-16-2":{"definitionAvailable":true,"label":{"de":"§16 Abs.2 StAG, ausl.minderjährige Kinder (b.2007)","en":"S.16(2),Nat.Act, foreign minor children (u.2007)","wiki":false},"classKey":"","compoundKey":null},"ST155":{"definitionAvailable":false,"label":{"de":"Slowakei","en":"Slovakia","wiki":false},"classKey":null,"compoundKey":null},"ST276":{"definitionAvailable":false,"label":{"de":"Sudan (einschließlich Südsudan) (bis 08.07.2011)","en":"Sudan (including South Sudan) (until 2011-07-08)","wiki":false},"classKey":"","compoundKey":null},"RECR-9-2":{"definitionAvailable":true,"label":{"de":"§9 Abs.2 StAngRegG, Dt.Volksz. im Ausland (b.2004)","en":"S.9(2),ActReg.Nat.Iss.,ethn.Germ.orig.abr.(u.2004)","wiki":false},"classKey":null,"compoundKey":null},"ST156":{"definitionAvailable":false,"label":{"de":"San Marino","en":"San Marino","wiki":false},"classKey":null,"compoundKey":null},"ST277":{"definitionAvailable":false,"label":{"de":"Sudan (ohne Südsudan) (ab 09.07.2011)","en":"Sudan (without South Sudan) (since 2011-07-09)","wiki":false},"classKey":"","compoundKey":null},"RECR-9-1":{"definitionAvailable":true,"label":{"de":"§9 Abs.1 StAngRegG, Dt.Volksz. im Ausland (b.2004)","en":"S.9(1),ActReg.Nat.Iss.,ethn.Germ.orig.abr.(u.2004)","wiki":false},"classKey":null,"compoundKey":null},"ST157":{"definitionAvailable":false,"label":{"de":"Schweden","en":"Sweden","wiki":false},"classKey":null,"compoundKey":null},"ST278":{"definitionAvailable":false,"label":{"de":"Südsudan (ab 09.07.2011)","en":"South Sudan (since 2011-07-09)","wiki":false},"classKey":"","compoundKey":null},"AFRIKASUED":{"definitionAvailable":false,"label":{"de":"Südafrika","en":"Southern Africa","wiki":false},"classKey":null,"compoundKey":null},"ST158":{"definitionAvailable":false,"label":{"de":"Schweiz","en":"Switzerland","wiki":false},"classKey":null,"compoundKey":null},"ST159":{"definitionAvailable":false,"label":{"de":"Sowjetunion (bis 25.12.1991)","en":"Soviet Union (until 1991-12-25)","wiki":false},"classKey":null,"compoundKey":null},"ASIENVOR":{"definitionAvailable":false,"label":{"de":"Vorderasien","en":"South West Asia","wiki":false},"classKey":null,"compoundKey":null},"ST150":{"definitionAvailable":false,"label":{"de":"Kosovo","en":"Kosovo","wiki":false},"classKey":null,"compoundKey":null},"ST271":{"definitionAvailable":false,"label":{"de":"Seychellen","en":"Seychelles","wiki":false},"classKey":null,"compoundKey":null},"ST151":{"definitionAvailable":false,"label":{"de":"Österreich","en":"Austria","wiki":false},"classKey":null,"compoundKey":null},"ST272":{"definitionAvailable":false,"label":{"de":"Sierra Leone","en":"Sierra Leone","wiki":false},"classKey":null,"compoundKey":null},"ST152":{"definitionAvailable":false,"label":{"de":"Polen","en":"Poland","wiki":false},"classKey":null,"compoundKey":null},"ST273":{"definitionAvailable":false,"label":{"de":"Somalia","en":"Somalia","wiki":false},"classKey":null,"compoundKey":null},"REC-SONST-ALT":{"definitionAvailable":true,"label":{"de":"Sonstige nicht mehr anwendbare Rechtsgrl. (b.2010)","en":"Other legal bases no longer applicable (u.2010)","wiki":false},"classKey":"","compoundKey":null},"ST274":{"definitionAvailable":false,"label":{"de":"Äquatorialguinea","en":"Equatorial Guinea","wiki":false},"classKey":null,"compoundKey":null},"ST153":{"definitionAvailable":false,"label":{"de":"Portugal","en":"Portugal","wiki":false},"classKey":null,"compoundKey":null},"ST154":{"definitionAvailable":false,"label":{"de":"Rumänien","en":"Romania","wiki":false},"classKey":null,"compoundKey":null},"LDR-GB":{"definitionAvailable":true,"label":{"de":"Vereinigtes Königreich einschl.brit.Überseegebiete","en":"United Kingdom incl. British overseas territories","wiki":false},"classKey":null,"compoundKey":null},"ST181":{"definitionAvailable":false,"label":{"de":"Zypern","en":"Cyprus","wiki":false},"classKey":"","compoundKey":null},"RECS-10-3-2":{"definitionAvailable":true,"label":{"de":"§10 Abs.3 S.2 StAG (i.V.m.§10 Abs.1 StAG) (b.2023)","en":"S.10(3),2.s.,Nat.Act(S.10(1)Nat.Act) (until 2023)","wiki":false},"classKey":"","compoundKey":null},"ST185":{"definitionAvailable":false,"label":{"de":"Britische Überseegebiete","en":"British Overseas Territories","wiki":false},"classKey":null,"compoundKey":null},"RECS-10-3-1":{"definitionAvailable":true,"label":{"de":"§10 Abs.3 S.1 StAG (i.V.m.§10 Abs.1 StAG) (b.2023)","en":"S.10(3),1.s.,Nat.Act(S.10(1)Nat.Act) (until 2023)","wiki":false},"classKey":"","compoundKey":null},"RECS-15ALT":{"definitionAvailable":true,"label":{"de":"§15 StAG Bundesbeamte im Ausland (bis 2004)","en":"S.15,Nat.Act,Fed.Governm. officials abroad(u.2004)","wiki":false},"classKey":"","compoundKey":null},"ST291":{"definitionAvailable":false,"label":{"de":"Burundi","en":"Burundi","wiki":false},"classKey":null,"compoundKey":null},"ST170":{"definitionAvailable":true,"label":{"de":"Serbien","en":"Serbia","wiki":false},"classKey":"","compoundKey":null},"EUROPA-EU-15":{"definitionAvailable":true,"label":{"de":"EU-15 (bis 30.04.2004)","en":"EU-15 (until 2004-04-30)","wiki":false},"classKey":null,"compoundKey":null},"LDR-YU":{"definitionAvailable":false,"label":{"de":"Gebiet des ehemaligen Jugoslawien","en":"Territory of former Yugoslavia","wiki":false},"classKey":null,"compoundKey":null},"RECA-85-1":{"definitionAvailable":true,"label":{"de":"§85 Abs.1 AuslG, Aufenth.i.Deutschl.>=8 J.(b.2004)","en":"S.85(1)FA,mandat.nat.,foreig.>8y. in Germ.(u.2004)","wiki":false},"classKey":null,"compoundKey":null},"RECA-85-2":{"definitionAvailable":true,"label":{"de":"§85 Abs.2 AuslG, Ehegatte u. mindj.Kinder (b.2004)","en":"S.85(2)FA,discr.nat.,spouses,child.of85(1)(u.2004)","wiki":false},"classKey":null,"compoundKey":null},"DG":{"definitionAvailable":false,"label":{"de":"Deutschland","en":"Germany","wiki":false},"classKey":null,"compoundKey":null},"DRITT-EU-28":{"definitionAvailable":false,"label":{"de":"Drittstaaten zu EU-28 (bis 31.01.2020)","en":"EU-28 third countries (until 2020-01-31)","wiki":false},"classKey":"","compoundKey":null},"DRITT-EU-27":{"definitionAvailable":false,"label":{"de":"Drittstaaten zu EU-27 (bis 30.06.2013)","en":"EU-27 third countries (until 2013-06-30)","wiki":false},"classKey":null,"compoundKey":null},"ST122":{"definitionAvailable":false,"label":{"de":"Bosnien und Herzegowina","en":"Bosnia and Herzegovina","wiki":false},"classKey":null,"compoundKey":null},"ST243":{"definitionAvailable":false,"label":{"de":"Kenia","en":"Kenya","wiki":false},"classKey":null,"compoundKey":null},"ST364":{"definitionAvailable":false,"label":{"de":"Suriname","en":"Suriname","wiki":false},"classKey":null,"compoundKey":null},"ST123":{"definitionAvailable":false,"label":{"de":"Andorra","en":"Andorra","wiki":false},"classKey":null,"compoundKey":null},"ST244":{"definitionAvailable":false,"label":{"de":"Komoren","en":"Comoros","wiki":false},"classKey":"","compoundKey":null},"ST365":{"definitionAvailable":false,"label":{"de":"Uruguay","en":"Uruguay","wiki":false},"classKey":null,"compoundKey":null},"ST124":{"definitionAvailable":false,"label":{"de":"Belgien","en":"Belgium","wiki":false},"classKey":null,"compoundKey":null},"ST245":{"definitionAvailable":false,"label":{"de":"Kongo, Republik","en":"Congo, Republic of the","wiki":false},"classKey":null,"compoundKey":null},"ST366":{"definitionAvailable":false,"label":{"de":"St. Lucia","en":"Saint Lucia","wiki":false},"classKey":null,"compoundKey":null},"ST125":{"definitionAvailable":false,"label":{"de":"Bulgarien","en":"Bulgaria","wiki":false},"classKey":null,"compoundKey":null},"ST246":{"definitionAvailable":true,"label":{"de":"Kongo, Demokratische Republik","en":"Congo, The Democratic Republic of the","wiki":false},"classKey":null,"compoundKey":null},"ST367":{"definitionAvailable":false,"label":{"de":"Venezuela, Bolivarische Republik","en":"Venezuela, Bolivarian Republic of","wiki":false},"classKey":null,"compoundKey":null},"ST126":{"definitionAvailable":false,"label":{"de":"Dänemark","en":"Denmark","wiki":false},"classKey":null,"compoundKey":null},"ST247":{"definitionAvailable":false,"label":{"de":"Liberia","en":"Liberia","wiki":false},"classKey":null,"compoundKey":null},"ST368":{"definitionAvailable":true,"label":{"de":"Vereinigte Staaten","en":"United States","wiki":false},"classKey":"","compoundKey":null},"ST127":{"definitionAvailable":false,"label":{"de":"Estland","en":"Estonia","wiki":false},"classKey":null,"compoundKey":null},"ST248":{"definitionAvailable":false,"label":{"de":"Libyen","en":"Libya","wiki":false},"classKey":null,"compoundKey":null},"ST369":{"definitionAvailable":false,"label":{"de":"St. Vincent und die Grenadinen","en":"Saint Vincent and the Grenadines","wiki":false},"classKey":null,"compoundKey":null},"ST128":{"definitionAvailable":false,"label":{"de":"Finnland","en":"Finland","wiki":false},"classKey":null,"compoundKey":null},"ST249":{"definitionAvailable":false,"label":{"de":"Madagaskar","en":"Madagascar","wiki":false},"classKey":null,"compoundKey":null},"ST129":{"definitionAvailable":false,"label":{"de":"Frankreich","en":"France","wiki":false},"classKey":null,"compoundKey":null},"EUROPA-EU-28":{"definitionAvailable":true,"label":{"de":"EU-28 (bis 31.01.2020)","en":"EU-28 (until 2020-01-31)","wiki":false},"classKey":"","compoundKey":null},"ST482":{"definitionAvailable":false,"label":{"de":"Malaysia","en":"Malaysia","wiki":false},"classKey":null,"compoundKey":null},"ST361":{"definitionAvailable":false,"label":{"de":"Peru","en":"Peru","wiki":false},"classKey":null,"compoundKey":null},"EUROPA-EU-27":{"definitionAvailable":true,"label":{"de":"EU-27 (bis 30.06.2013)","en":"EU-27 (until 2013-06-30)","wiki":false},"classKey":null,"compoundKey":null},"ST120":{"definitionAvailable":true,"label":{"de":"Jugoslawien, Soz. Föd. Republik (bis 26.04.1992)","en":"Yugoslavia, Socialist Federal Rep. (u. 1992-04-26)","wiki":false},"classKey":null,"compoundKey":null},"ST483":{"definitionAvailable":false,"label":{"de":"Timor-Leste","en":"Timor-Leste","wiki":false},"classKey":null,"compoundKey":null},"ST121":{"definitionAvailable":false,"label":{"de":"Albanien","en":"Albania","wiki":false},"classKey":null,"compoundKey":null},"ST242":{"definitionAvailable":true,"label":{"de":"Cabo Verde","en":"Cabo Verde","wiki":false},"classKey":"","compoundKey":null},"EUROPA-EU-25":{"definitionAvailable":true,"label":{"de":"EU-25 (bis 31.12.2006)","en":"EU-25 (until 2006-12-31)","wiki":false},"classKey":null,"compoundKey":null},"EINBUERG01":{"definitionAvailable":true,"label":{"de":"Einbürgerungen m.fortbestehender bish.Staatsangeh.","en":"Naturalisations with former citizenship retained","wiki":false},"classKey":"","compoundKey":null},"EINBUERG02":{"definitionAvailable":true,"label":{"de":"Einbürgerungen m.nicht fortbest. bish.Staatsangeh.","en":"Naturalisations w. former citizenship not retained","wiki":false},"classKey":"","compoundKey":null},"DRITT-EU-25":{"definitionAvailable":false,"label":{"de":"Drittstaaten zu EU-25 (bis 31.12.2006)","en":"EU-25 third countries (until 2006-12-31)","wiki":false},"classKey":null,"compoundKey":null},"LDR-SU":{"definitionAvailable":false,"label":{"de":"Gebiet der ehemaligen Sowjetunion","en":"Territory of the former Soviet Union","wiki":false},"classKey":null,"compoundKey":null},"ST353":{"definitionAvailable":false,"label":{"de":"Mexiko","en":"Mexico","wiki":false},"classKey":null,"compoundKey":null},"ST232":{"definitionAvailable":false,"label":{"de":"Nigeria","en":"Nigeria","wiki":false},"classKey":null,"compoundKey":null},"ST474":{"definitionAvailable":false,"label":{"de":"Singapur","en":"Singapore","wiki":false},"classKey":null,"compoundKey":null},"2001":{"definitionAvailable":false,"label":{"de":"2001","en":"2001","wiki":false},"classKey":null,"compoundKey":null},"ST354":{"definitionAvailable":false,"label":{"de":"Nicaragua","en":"Nicaragua","wiki":false},"classKey":null,"compoundKey":null},"ST233":{"definitionAvailable":false,"label":{"de":"Simbabwe","en":"Zimbabwe","wiki":false},"classKey":null,"compoundKey":null},"ST475":{"definitionAvailable":false,"label":{"de":"Syrien","en":"Syrian","wiki":false},"classKey":null,"compoundKey":null},"2000":{"definitionAvailable":false,"label":{"de":"2000","en":"2000","wiki":false},"classKey":null,"compoundKey":null},"ST355":{"definitionAvailable":false,"label":{"de":"Jamaika","en":"Jamaica","wiki":false},"classKey":null,"compoundKey":null},"ST476":{"definitionAvailable":false,"label":{"de":"Thailand","en":"Thailand","wiki":false},"classKey":null,"compoundKey":null},"ST477":{"definitionAvailable":false,"label":{"de":"Usbekistan","en":"Uzbekistan","wiki":false},"classKey":null,"compoundKey":null},"ST236":{"definitionAvailable":false,"label":{"de":"Gabun","en":"Gabon","wiki":false},"classKey":"","compoundKey":null},"ST357":{"definitionAvailable":false,"label":{"de":"Panama","en":"Panama","wiki":false},"classKey":null,"compoundKey":null},"ST479":{"definitionAvailable":false,"label":{"de":"China","en":"China","wiki":false},"classKey":null,"compoundKey":null},"ST237":{"definitionAvailable":false,"label":{"de":"Gambia","en":"Gambia","wiki":false},"classKey":"","compoundKey":null},"DRITT-EU-27-1":{"definitionAvailable":false,"label":{"de":"Drittstaaten zu EU-27 (seit 01.02.2020)","en":"EU-27 third countries (since 2020-02-01)","wiki":false},"classKey":"","compoundKey":null},"ST238":{"definitionAvailable":false,"label":{"de":"Ghana","en":"Ghana","wiki":false},"classKey":null,"compoundKey":null},"ST359":{"definitionAvailable":false,"label":{"de":"Paraguay","en":"Paraguay","wiki":false},"classKey":null,"compoundKey":null},"ST239":{"definitionAvailable":false,"label":{"de":"Mauretanien","en":"Mauritania","wiki":false},"classKey":"","compoundKey":null},"ST470":{"definitionAvailable":false,"label":{"de":"Tadschikistan","en":"Tajikistan","wiki":false},"classKey":null,"compoundKey":null},"ST471":{"definitionAvailable":false,"label":{"de":"Turkmenistan","en":"Turkmenistan","wiki":false},"classKey":null,"compoundKey":null},"AFRIKAZENTR":{"definitionAvailable":false,"label":{"de":"Zentralafrika","en":"Central Africa","wiki":false},"classKey":null,"compoundKey":null},"ST230":{"definitionAvailable":false,"label":{"de":"Dschibuti","en":"Djibouti","wiki":false},"classKey":null,"compoundKey":null},"ST351":{"definitionAvailable":false,"label":{"de":"Kuba","en":"Cuba","wiki":false},"classKey":null,"compoundKey":null},"ST472":{"definitionAvailable":false,"label":{"de":"Saudi-Arabien","en":"Saudi Arabia","wiki":false},"classKey":"","compoundKey":null},"ST231":{"definitionAvailable":false,"label":{"de":"Cote d'Ivoire","en":"Cote d'Ivoire","wiki":false},"classKey":null,"compoundKey":null},"RECR-11":{"definitionAvailable":true,"label":{"de":"§11 StAngRegG, Dt. Volkszugeh. im Inland (b.2010)","en":"S.11,Act Reg.Nation.Issues, ethnic Germ. (u.2010)","wiki":false},"classKey":"","compoundKey":null},"LDR-SM":{"definitionAvailable":false,"label":{"de":"Gebiet des ehemaligen Serbien und Montenegro","en":"Territory of former Serbia and Montenegro","wiki":false},"classKey":null,"compoundKey":null},"DRITT-EU-15":{"definitionAvailable":false,"label":{"de":"Drittstaaten zu EU-15 (bis 30.04.2004)","en":"EU-15 third countries (until 2004-04-30)","wiki":false},"classKey":null,"compoundKey":null},"EUROPA-EG-12":{"definitionAvailable":true,"label":{"de":"EG-12 (bis 31.12.1994)","en":"EC-12 (until 1994-12-31)","wiki":false},"classKey":null,"compoundKey":null},"EUROPA-EG-10":{"definitionAvailable":true,"label":{"de":"EG-10 (bis 31.12.1985)","en":"EC-10 (until 1985-12-31)","wiki":false},"classKey":null,"compoundKey":null},"ST144":{"definitionAvailable":true,"label":{"de":"Nordmazedonien","en":"North Macedonia","wiki":false},"classKey":"","compoundKey":null},"ST265":{"definitionAvailable":false,"label":{"de":"Ruanda","en":"Rwanda","wiki":false},"classKey":null,"compoundKey":null},"2012":{"definitionAvailable":false,"label":{"de":"2012","en":"2012","wiki":false},"classKey":null,"compoundKey":null},"ST145":{"definitionAvailable":false,"label":{"de":"Malta","en":"Malta","wiki":false},"classKey":"","compoundKey":null},"2011":{"definitionAvailable":false,"label":{"de":"2011","en":"2011","wiki":false},"classKey":null,"compoundKey":null},"ST146":{"definitionAvailable":false,"label":{"de":"Moldau, Republik","en":"Moldova, Republic of","wiki":false},"classKey":null,"compoundKey":null},"ST267":{"definitionAvailable":false,"label":{"de":"Namibia","en":"Namibia","wiki":false},"classKey":null,"compoundKey":null},"2010":{"definitionAvailable":false,"label":{"de":"2010","en":"2010","wiki":false},"classKey":null,"compoundKey":null},"ST147":{"definitionAvailable":false,"label":{"de":"Monaco","en":"Monaco","wiki":false},"classKey":null,"compoundKey":null},"ST268":{"definitionAvailable":false,"label":{"de":"Sao Tome und Principe","en":"Sao Tome and Principe","wiki":false},"classKey":null,"compoundKey":null},"ST148":{"definitionAvailable":false,"label":{"de":"Niederlande","en":"Netherlands","wiki":false},"classKey":null,"compoundKey":null},"ST269":{"definitionAvailable":false,"label":{"de":"Senegal","en":"Senegal","wiki":false},"classKey":"","compoundKey":null},"RECR-12-1":{"definitionAvailable":true,"label":{"de":"§12 Abs.1 StAngRegG,Frühere dt.Staatsang. (b.2010)","en":"S.12(1),Act Reg.Nation.Issues,former Germ.(u.2010)","wiki":false},"classKey":"","compoundKey":null},"ST149":{"definitionAvailable":false,"label":{"de":"Norwegen","en":"Norway","wiki":false},"classKey":null,"compoundKey":null},"2009":{"definitionAvailable":false,"label":{"de":"2009","en":"2009","wiki":false},"classKey":null,"compoundKey":null},"2008":{"definitionAvailable":false,"label":{"de":"2008","en":"2008","wiki":false},"classKey":null,"compoundKey":null},"2007":{"definitionAvailable":false,"label":{"de":"2007","en":"2007","wiki":false},"classKey":null,"compoundKey":null},"2006":{"definitionAvailable":false,"label":{"de":"2006","en":"2006","wiki":false},"classKey":null,"compoundKey":null},"ST261":{"definitionAvailable":false,"label":{"de":"Guinea","en":"Guinea","wiki":false},"classKey":"","compoundKey":null},"ST140":{"definitionAvailable":false,"label":{"de":"Montenegro (ab 03.06.2006)","en":"Montenegro (since 2006-06-03)","wiki":false},"classKey":null,"compoundKey":null},"2005":{"definitionAvailable":false,"label":{"de":"2005","en":"2005","wiki":false},"classKey":null,"compoundKey":null},"RECR-8":{"definitionAvailable":true,"label":{"de":"§8 StAngRegG,Dt.Volkszugehörige im Inland (b.2004)","en":"S.8,ActReg.Nat.Iss.,ethn.Germ.orig.inGerm.(u.2004)","wiki":false},"classKey":null,"compoundKey":null},"ST262":{"definitionAvailable":false,"label":{"de":"Kamerun","en":"Cameroon","wiki":false},"classKey":null,"compoundKey":null},"ST141":{"definitionAvailable":false,"label":{"de":"Liechtenstein","en":"Liechtenstein","wiki":false},"classKey":null,"compoundKey":null},"STAAT900":{"definitionAvailable":false,"label":{"de":"Ungeklärt / Ohne Angabe","en":"Unknown / Not specified","wiki":false},"classKey":null,"compoundKey":null},"2004":{"definitionAvailable":false,"label":{"de":"2004","en":"2004","wiki":false},"classKey":null,"compoundKey":null},"ST142":{"definitionAvailable":false,"label":{"de":"Litauen","en":"Lithuania","wiki":false},"classKey":null,"compoundKey":null},"ST263":{"definitionAvailable":false,"label":{"de":"Südafrika","en":"South Africa","wiki":false},"classKey":null,"compoundKey":null},"2003":{"definitionAvailable":false,"label":{"de":"2003","en":"2003","wiki":false},"classKey":null,"compoundKey":null},"ST143":{"definitionAvailable":false,"label":{"de":"Luxemburg","en":"Luxembourg","wiki":false},"classKey":null,"compoundKey":null},"2002":{"definitionAvailable":false,"label":{"de":"2002","en":"2002","wiki":false},"classKey":null,"compoundKey":null},"RECR-9":{"definitionAvailable":true,"label":{"de":"§9 StAngRegG, Dt. Volkszugeh. im Ausland (b.2004)","en":"S.9,Act Reg.Nat.Iss.,ethn.Germ.orig.abroad(u.2004)","wiki":false},"classKey":"","compoundKey":null},"EUROPA-EG-09":{"definitionAvailable":true,"label":{"de":"EG-9 (bis 31.12.1980)","en":"EC-9 (until 1980-12-31)","wiki":false},"classKey":null,"compoundKey":null},"LDR-CZ":{"definitionAvailable":false,"label":{"de":"Gebiet der ehemaligen Tschechoslowakei","en":"Territory of former Czechoslovakia","wiki":false},"classKey":null,"compoundKey":null},"ST254":{"definitionAvailable":false,"label":{"de":"Mosambik","en":"Mozambique","wiki":false},"classKey":null,"compoundKey":null},"ST133":{"definitionAvailable":true,"label":{"de":"Serbien (einschl. Kosovo) (03.06.2006-16.02.2008)","en":"Serbia (incl. Kosovo) (2006-06-03 to 2008-02-16)","wiki":false},"classKey":null,"compoundKey":null},"2023":{"definitionAvailable":false,"label":{"de":"2023","en":"2023","wiki":false},"classKey":null,"compoundKey":null},"ST134":{"definitionAvailable":false,"label":{"de":"Griechenland","en":"Greece","wiki":false},"classKey":null,"compoundKey":null},"ST255":{"definitionAvailable":false,"label":{"de":"Niger","en":"Niger","wiki":false},"classKey":"","compoundKey":null},"2022":{"definitionAvailable":false,"label":{"de":"2022","en":"2022","wiki":false},"classKey":null,"compoundKey":null},"ST135":{"definitionAvailable":false,"label":{"de":"Irland","en":"Ireland","wiki":false},"classKey":null,"compoundKey":null},"ST256":{"definitionAvailable":false,"label":{"de":"Malawi","en":"Malawi","wiki":false},"classKey":null,"compoundKey":null},"2021":{"definitionAvailable":false,"label":{"de":"2021","en":"2021","wiki":false},"classKey":null,"compoundKey":null},"ST136":{"definitionAvailable":false,"label":{"de":"Island","en":"Iceland","wiki":false},"classKey":null,"compoundKey":null},"ST257":{"definitionAvailable":false,"label":{"de":"Sambia","en":"Zambia","wiki":false},"classKey":"","compoundKey":null},"2020":{"definitionAvailable":false,"label":{"de":"2020","en":"2020","wiki":false},"classKey":null,"compoundKey":null},"ST258":{"definitionAvailable":false,"label":{"de":"Burkina Faso","en":"Burkina Faso","wiki":false},"classKey":null,"compoundKey":null},"ST137":{"definitionAvailable":false,"label":{"de":"Italien","en":"Italy","wiki":false},"classKey":null,"compoundKey":null},"ST259":{"definitionAvailable":false,"label":{"de":"Guinea-Bissau","en":"Guinea-Bissau","wiki":false},"classKey":"","compoundKey":null},"ST138":{"definitionAvailable":true,"label":{"de":"Jugoslawien, Bundesrep. (27.04.1992-04.02.2003)","en":"Yugoslavia, Federal Rep.(1992-04-27 to 2003-02-04)","wiki":false},"classKey":null,"compoundKey":null},"ST139":{"definitionAvailable":false,"label":{"de":"Lettland","en":"Latvia","wiki":false},"classKey":null,"compoundKey":null},"2019":{"definitionAvailable":false,"label":{"de":"2019","en":"2019","wiki":false},"classKey":null,"compoundKey":null},"2018":{"definitionAvailable":false,"label":{"de":"2018","en":"2018","wiki":false},"classKey":null,"compoundKey":null},"AFRIKANORD":{"definitionAvailable":false,"label":{"de":"Nordafrika","en":"North Africa","wiki":false},"classKey":null,"compoundKey":null},"ST370":{"definitionAvailable":false,"label":{"de":"St. Kitts und Nevis","en":"Saint Kitts and Nevis","wiki":false},"classKey":null,"compoundKey":null},"2017":{"definitionAvailable":false,"label":{"de":"2017","en":"2017","wiki":false},"classKey":null,"compoundKey":null},"ST371":{"definitionAvailable":false,"label":{"de":"Trinidad und Tobago","en":"Trinidad and Tobago","wiki":false},"classKey":null,"compoundKey":null},"2016":{"definitionAvailable":false,"label":{"de":"2016","en":"2016","wiki":false},"classKey":null,"compoundKey":null},"ST130":{"definitionAvailable":false,"label":{"de":"Kroatien","en":"Croatia","wiki":false},"classKey":"","compoundKey":null},"ST251":{"definitionAvailable":false,"label":{"de":"Mali","en":"Mali","wiki":false},"classKey":null,"compoundKey":null},"2015":{"definitionAvailable":false,"label":{"de":"2015","en":"2015","wiki":false},"classKey":null,"compoundKey":null},"AMERIKAMIT2":{"definitionAvailable":false,"label":{"de":"Mittelamerika und Karibik","en":"Central America and Caribbean","wiki":false},"classKey":null,"compoundKey":null},"ST252":{"definitionAvailable":false,"label":{"de":"Marokko","en":"Morocco","wiki":false},"classKey":null,"compoundKey":null},"ST131":{"definitionAvailable":false,"label":{"de":"Slowenien","en":"Slovenia","wiki":false},"classKey":null,"compoundKey":null},"2014":{"definitionAvailable":false,"label":{"de":"2014","en":"2014","wiki":false},"classKey":null,"compoundKey":null},"ST253":{"definitionAvailable":false,"label":{"de":"Mauritius","en":"Mauritius","wiki":false},"classKey":null,"compoundKey":null},"ST132":{"definitionAvailable":false,"label":{"de":"Serbien und Montenegro (05.02.2003-02.06.2006)","en":"Serbia and Montenegro (2003-02-05 to 2006-06-02)","wiki":false},"classKey":null,"compoundKey":null},"2013":{"definitionAvailable":false,"label":{"de":"2013","en":"2013","wiki":false},"classKey":null,"compoundKey":null},"%TOTAL%":{"definitionAvailable":false,"label":{"de":"Insgesamt","en":"Total","wiki":false},"classKey":null,"compoundKey":null},"AFRIKAWEST":{"definitionAvailable":false,"label":{"de":"Westafrika","en":"West Africa","wiki":false},"classKey":null,"compoundKey":null},"ASIEN":{"definitionAvailable":false,"label":{"de":"Asien","en":"Asia","wiki":false},"classKey":null,"compoundKey":null},"ST328":{"definitionAvailable":false,"label":{"de":"Guyana","en":"Guyana","wiki":false},"classKey":null,"compoundKey":null},"ST449":{"definitionAvailable":false,"label":{"de":"Laos, Demokratische Volksrepublik","en":"Lao People's Democratic Republic","wiki":false},"classKey":null,"compoundKey":null},"ST320":{"definitionAvailable":false,"label":{"de":"Antigua und Barbuda","en":"Antigua and Barbuda","wiki":false},"classKey":null,"compoundKey":null},"ST441":{"definitionAvailable":false,"label":{"de":"Israel","en":"Israel","wiki":false},"classKey":null,"compoundKey":null},"ST442":{"definitionAvailable":false,"label":{"de":"Japan","en":"Japan","wiki":false},"classKey":null,"compoundKey":null},"ST322":{"definitionAvailable":false,"label":{"de":"Barbados","en":"Barbados","wiki":false},"classKey":null,"compoundKey":null},"ST323":{"definitionAvailable":false,"label":{"de":"Argentinien","en":"Argentina","wiki":false},"classKey":null,"compoundKey":null},"ST444":{"definitionAvailable":false,"label":{"de":"Kasachstan","en":"Kazakhstan","wiki":false},"classKey":null,"compoundKey":null},"DRITT-EWG-06":{"definitionAvailable":false,"label":{"de":"Drittstaaten zu EWG-6 (bis 31.12.1972)","en":"EEC-6 third countries (until 1972-12-31)","wiki":false},"classKey":null,"compoundKey":null},"ST324":{"definitionAvailable":false,"label":{"de":"Bahamas","en":"Bahamas","wiki":false},"classKey":null,"compoundKey":null},"ST445":{"definitionAvailable":false,"label":{"de":"Jordanien","en":"Jordan","wiki":false},"classKey":null,"compoundKey":null},"EUROPA":{"definitionAvailable":false,"label":{"de":"Europa","en":"Europe","wiki":false},"classKey":null,"compoundKey":null},"ST446":{"definitionAvailable":false,"label":{"de":"Kambodscha","en":"Cambodia","wiki":false},"classKey":"","compoundKey":null},"ST326":{"definitionAvailable":false,"label":{"de":"Bolivien, Plurinationaler Staat","en":"Bolivia, Plurinational State","wiki":false},"classKey":null,"compoundKey":null},"ST447":{"definitionAvailable":false,"label":{"de":"Katar","en":"Qatar","wiki":false},"classKey":"","compoundKey":null},"ST327":{"definitionAvailable":false,"label":{"de":"Brasilien","en":"Brazil","wiki":false},"classKey":null,"compoundKey":null},"ST448":{"definitionAvailable":false,"label":{"de":"Kuwait","en":"Kuwait","wiki":false},"classKey":null,"compoundKey":null},"RECS-9":{"definitionAvailable":true,"label":{"de":"§9 StAG, Ehe- oder Lebenspartner ist Deutscher","en":"S.9,Nat.Act,natur.of foreigners with German spouse","wiki":false},"classKey":null,"compoundKey":null},"RECS-8":{"definitionAvailable":true,"label":{"de":"§8 StAG, Niederlassung in Deutschland auf Dauer","en":"S.8,Nat.Act,natur.foreig.settled perman. in Germ.","wiki":false},"classKey":null,"compoundKey":null},"RECH-21":{"definitionAvailable":true,"label":{"de":"§21 HAuslG, Heimatlose Ausländer","en":"S.21,Act Legal Stat.Displaced Foreig.,7y. in Germ.","wiki":false},"classKey":null,"compoundKey":null},"RECS-15":{"definitionAvailable":true,"label":{"de":"§15 StAG, Wiedergutmachungseinbürg.nach Verfolgung","en":"S.15,Nat.Act,reparation natural. after persecution","wiki":false},"classKey":"","compoundKey":null},"RECS-14":{"definitionAvailable":true,"label":{"de":"§14 StAG, Ausl.m.Bindungen an Dtl., i.Ausl.lebend","en":"S.14,Nat.Act,nat. of pers.abroad, ties with Germ.","wiki":false},"classKey":"","compoundKey":null},"RECS-13":{"definitionAvailable":true,"label":{"de":"§13 StAG, Ehemalige Deutsche im Ausland lebend","en":"S.13,Nat.Act,nat. of former Germans abroad a.desc.","wiki":false},"classKey":"","compoundKey":null},"ST438":{"definitionAvailable":false,"label":{"de":"Irak","en":"Iraq","wiki":false},"classKey":null,"compoundKey":null},"ST439":{"definitionAvailable":false,"label":{"de":"Iran, Islamische Republik","en":"Iran, Islamic Republic of","wiki":false},"classKey":"","compoundKey":null},"ST430":{"definitionAvailable":false,"label":{"de":"Georgien","en":"Georgia","wiki":false},"classKey":null,"compoundKey":null},"ST431":{"definitionAvailable":false,"label":{"de":"Sri Lanka","en":"Sri Lanka","wiki":false},"classKey":null,"compoundKey":null},"ST432":{"definitionAvailable":false,"label":{"de":"Vietnam","en":"Viet Nam","wiki":false},"classKey":null,"compoundKey":null},"AMERIKA":{"definitionAvailable":false,"label":{"de":"Amerika","en":"America","wiki":false},"classKey":null,"compoundKey":null},"RECR1-6":{"definitionAvailable":true,"label":{"de":"§6 (1.StaRegG), Aussiedler/Spätaussiedler (b.1999)","en":"S.6,FirstActReg.Nat.Iss.,ethn.Germ.repatr.(u.1999)","wiki":false},"classKey":null,"compoundKey":null},"ST434":{"definitionAvailable":false,"label":{"de":"Korea, Demokratische Volksrepublik","en":"Korea, Democratic People's Republic","wiki":false},"classKey":null,"compoundKey":null},"ST436":{"definitionAvailable":true,"label":{"de":"Indien","en":"India","wiki":false},"classKey":null,"compoundKey":null},"ST437":{"definitionAvailable":true,"label":{"de":"Indonesien","en":"Indonesia","wiki":false},"classKey":null,"compoundKey":null},"RECG-116-2-1":{"definitionAvailable":true,"label":{"de":"Art.116 Abs.2 S.1 GG, Frühere deutsche Staatsang.","en":"Art.116(2),1.s.,Basic Law, former Germans, 1933-45","wiki":false},"classKey":null,"compoundKey":null},"ST229":{"definitionAvailable":false,"label":{"de":"Benin","en":"Benin","wiki":false},"classKey":"","compoundKey":null},"RECA-86-2ALT":{"definitionAvailable":true,"label":{"de":"§86 Abs.2 AuslG, a.F., Ehegatte u. Kinder (b.2004)","en":"S.86(2)FA,old v.,discr.nat.,spou.,ch.86(1)(u.2004)","wiki":false},"classKey":null,"compoundKey":null},"ST221":{"definitionAvailable":false,"label":{"de":"Algerien","en":"Algeria","wiki":false},"classKey":null,"compoundKey":null},"RECRS-8":{"definitionAvailable":true,"label":{"de":"§8 RuStAG, Einbürgerung von Ausländern (bis 1999)","en":"S.8,Nat.Act, naturalisation of foreigners (u.1999)","wiki":false},"classKey":null,"compoundKey":null},"RECRS-9":{"definitionAvailable":true,"label":{"de":"§9 RuStAG, Ehegatten Deutscher (bis 1999)","en":"S.9,Nat.Act,natural. of spouses of Germans(u.1999)","wiki":false},"classKey":null,"compoundKey":null},"ST223":{"definitionAvailable":false,"label":{"de":"Angola","en":"Angola","wiki":false},"classKey":"","compoundKey":null},"ST465":{"definitionAvailable":false,"label":{"de":"Taiwan","en":"Taiwan","wiki":false},"classKey":null,"compoundKey":null},"ST224":{"definitionAvailable":false,"label":{"de":"Eritrea","en":"Eritrea","wiki":false},"classKey":null,"compoundKey":null},"ST345":{"definitionAvailable":false,"label":{"de":"Guatemala","en":"Guatemala","wiki":false},"classKey":"","compoundKey":null},"ST225":{"definitionAvailable":false,"label":{"de":"Äthiopien","en":"Ethiopia","wiki":false},"classKey":null,"compoundKey":null},"ST346":{"definitionAvailable":false,"label":{"de":"Haiti","en":"Haiti","wiki":false},"classKey":null,"compoundKey":null},"ST467":{"definitionAvailable":false,"label":{"de":"Korea, Republik","en":"Korea, Republic of","wiki":false},"classKey":"","compoundKey":null},"ST347":{"definitionAvailable":false,"label":{"de":"Honduras","en":"Honduras","wiki":false},"classKey":null,"compoundKey":null},"ST226":{"definitionAvailable":false,"label":{"de":"Lesotho","en":"Lesotho","wiki":false},"classKey":"","compoundKey":null},"ST227":{"definitionAvailable":false,"label":{"de":"Botsuana","en":"Botswana","wiki":false},"classKey":"","compoundKey":null},"ST348":{"definitionAvailable":false,"label":{"de":"Kanada","en":"Canada","wiki":false},"classKey":null,"compoundKey":null},"ST469":{"definitionAvailable":false,"label":{"de":"Vereinigte Arabische Emirate","en":"United Arab Emirates","wiki":false},"classKey":null,"compoundKey":null},"ST349":{"definitionAvailable":false,"label":{"de":"Kolumbien","en":"Colombia","wiki":false},"classKey":null,"compoundKey":null},"ST460":{"definitionAvailable":false,"label":{"de":"Bangladesch","en":"Bangladesh","wiki":false},"classKey":null,"compoundKey":null},"ST340":{"definitionAvailable":false,"label":{"de":"Grenada","en":"Grenada","wiki":false},"classKey":null,"compoundKey":null},"ST461":{"definitionAvailable":false,"label":{"de":"Pakistan","en":"Pakistan","wiki":false},"classKey":null,"compoundKey":null},"ST462":{"definitionAvailable":false,"label":{"de":"Philippinen","en":"Philippines","wiki":false},"classKey":null,"compoundKey":null},"ST332":{"definitionAvailable":false,"label":{"de":"Chile","en":"Chile","wiki":false},"classKey":null,"compoundKey":null},"ST333":{"definitionAvailable":false,"label":{"de":"Dominica","en":"Dominica","wiki":false},"classKey":null,"compoundKey":null},"ST454":{"definitionAvailable":false,"label":{"de":"Malediven","en":"Maldives","wiki":false},"classKey":"","compoundKey":null},"ST334":{"definitionAvailable":false,"label":{"de":"Costa Rica","en":"Costa Rica","wiki":false},"classKey":null,"compoundKey":null},"ST335":{"definitionAvailable":false,"label":{"de":"Dominikanische Republik","en":"Dominican Republic","wiki":false},"classKey":null,"compoundKey":null},"ST456":{"definitionAvailable":false,"label":{"de":"Oman","en":"Oman","wiki":false},"classKey":"","compoundKey":null},"ST336":{"definitionAvailable":false,"label":{"de":"Ecuador","en":"Ecuador","wiki":false},"classKey":null,"compoundKey":null},"ST457":{"definitionAvailable":false,"label":{"de":"Mongolei","en":"Mongolia","wiki":false},"classKey":null,"compoundKey":null},"ST337":{"definitionAvailable":false,"label":{"de":"El Salvador","en":"El Salvador","wiki":false},"classKey":null,"compoundKey":null},"ST458":{"definitionAvailable":false,"label":{"de":"Nepal","en":"Nepal","wiki":false},"classKey":null,"compoundKey":null},"ST459":{"definitionAvailable":false,"label":{"de":"Palästinensische Gebiete","en":"Palestinian Territories","wiki":false},"classKey":null,"compoundKey":null},"RECS-40C":{"definitionAvailable":true,"label":{"de":"§40c StAG, Übergangsreg. b. Anträgen b. 30.03.2007","en":"S.40c,Nat.Act,trans.provision,applic.30 March 2007","wiki":false},"classKey":null,"compoundKey":null},"RECS-40B":{"definitionAvailable":true,"label":{"de":"§40b StAG, Übergangsregelung für Kinder","en":"S.40b,Nat.Act,trans.prov.childr.born in G., <10y.","wiki":false},"classKey":null,"compoundKey":null},"ST450":{"definitionAvailable":false,"label":{"de":"Kirgisistan","en":"Kyrgyzstan","wiki":false},"classKey":null,"compoundKey":null},"ST330":{"definitionAvailable":false,"label":{"de":"Belize","en":"Belize","wiki":false},"classKey":"","compoundKey":null},"ST451":{"definitionAvailable":false,"label":{"de":"Libanon","en":"Lebanon","wiki":false},"classKey":null,"compoundKey":null},"ASIENSUED2":{"definitionAvailable":false,"label":{"de":"Süd- und Südostasien","en":"South and South East Asia","wiki":false},"classKey":null,"compoundKey":null},"ST526":{"definitionAvailable":false,"label":{"de":"Fidschi","en":"Fiji","wiki":false},"classKey":null,"compoundKey":null},"AMERIKANORD":{"definitionAvailable":false,"label":{"de":"Nordamerika","en":"North America","wiki":false},"classKey":null,"compoundKey":null},"ST523":{"definitionAvailable":false,"label":{"de":"Australien","en":"Australia","wiki":false},"classKey":null,"compoundKey":null},"ST524":{"definitionAvailable":false,"label":{"de":"Salomonen","en":"Solomon Islands","wiki":false},"classKey":null,"compoundKey":null},"GESM":{"definitionAvailable":false,"label":{"de":"männlich","en":"Male","wiki":false},"classKey":null,"compoundKey":null},"AFRIKA":{"definitionAvailable":false,"label":{"de":"Afrika","en":"Africa","wiki":false},"classKey":null,"compoundKey":null},"ST997":{"definitionAvailable":false,"label":{"de":"Staatenlos","en":"Stateless","wiki":false},"classKey":null,"compoundKey":null},"ASIENOST2":{"definitionAvailable":false,"label":{"de":"Ost- und Zentralasien","en":"East and Central Asia","wiki":false},"classKey":null,"compoundKey":null},"RECS-10-1":{"definitionAvailable":true,"label":{"de":"§10 Abs.1 StAG, Aufenthalt in Deutschland","en":"S.10(1),Nat.Act, natural. of residents in Germany","wiki":false},"classKey":"","compoundKey":null},"AFRIKAOST":{"definitionAvailable":false,"label":{"de":"Ostafrika","en":"East Africa","wiki":false},"classKey":null,"compoundKey":null},"RECS-10-3":{"definitionAvailable":true,"label":{"de":"§10 Abs.3 StAG (i.V.m. § 10 Abs.1 StAG)","en":"S.10(3),Nat.Act (S.10(1), Nat.Act)","wiki":false},"classKey":"","compoundKey":null},"RECS-10-2":{"definitionAvailable":true,"label":{"de":"§10 Abs.2 StAG, Ehegatte, minderjährige Kinder","en":"S.10(2),Nat.Act,derivative nat.,spouse,min.childr.","wiki":false},"classKey":null,"compoundKey":null},"ST427":{"definitionAvailable":false,"label":{"de":"Myanmar","en":"Myanmar","wiki":false},"classKey":"","compoundKey":null},"ST429":{"definitionAvailable":false,"label":{"de":"Brunei Darussalam","en":"Brunei Darussalam","wiki":false},"classKey":null,"compoundKey":null},"LDR-GASTARB":{"definitionAvailable":false,"label":{"de":"Gastarbeiterländer","en":"Countries of origin of foreign workers","wiki":false},"classKey":null,"compoundKey":null},"ST540":{"definitionAvailable":false,"label":{"de":"Tuvalu","en":"Tuvalu","wiki":false},"classKey":null,"compoundKey":null},"ST541":{"definitionAvailable":false,"label":{"de":"Tonga","en":"Tonga","wiki":false},"classKey":null,"compoundKey":null},"ST421":{"definitionAvailable":false,"label":{"de":"Jemen","en":"Yemen","wiki":false},"classKey":null,"compoundKey":null},"ST422":{"definitionAvailable":false,"label":{"de":"Armenien","en":"Armenia","wiki":false},"classKey":null,"compoundKey":null},"ST543":{"definitionAvailable":false,"label":{"de":"Samoa","en":"Samoa","wiki":false},"classKey":null,"compoundKey":null},"ST423":{"definitionAvailable":false,"label":{"de":"Afghanistan","en":"Afghanistan, Republic of","wiki":false},"classKey":null,"compoundKey":null},"ST544":{"definitionAvailable":false,"label":{"de":"Marshallinseln","en":"Marshall Islands","wiki":false},"classKey":null,"compoundKey":null},"ST424":{"definitionAvailable":false,"label":{"de":"Bahrain","en":"Bahrain","wiki":false},"classKey":"","compoundKey":null},"ST545":{"definitionAvailable":false,"label":{"de":"Mikronesien, Föderierte Staaten von","en":"Micronesia, Federated States of","wiki":false},"classKey":null,"compoundKey":null},"ST425":{"definitionAvailable":false,"label":{"de":"Aserbaidschan","en":"Azerbaijan","wiki":false},"classKey":null,"compoundKey":null},"ST426":{"definitionAvailable":false,"label":{"de":"Bhutan","en":"Bhutan","wiki":false},"classKey":"","compoundKey":null},"RECV-2":{"definitionAvailable":true,"label":{"de":"Art.2 d. Gesetzes z. Vermind. der Staatenlosigkeit","en":"S.2,Act Red.Statelessness,natur.,5y.in Germ.,<21y.","wiki":false},"classKey":null,"compoundKey":null},"ST537":{"definitionAvailable":false,"label":{"de":"Palau","en":"Palau","wiki":false},"classKey":null,"compoundKey":null},"ST538":{"definitionAvailable":false,"label":{"de":"Papua-Neuguinea","en":"Papua New Guinea","wiki":false},"classKey":null,"compoundKey":null},"GESW":{"definitionAvailable":false,"label":{"de":"weiblich","en":"Female","wiki":false},"classKey":null,"compoundKey":null},"EUROPA-EWG-06":{"definitionAvailable":true,"label":{"de":"EWG-6 (bis 31.12.1972)","en":"EEC-6 (until 1972-12-31)","wiki":false},"classKey":null,"compoundKey":null},"RECA-86-1ALT":{"definitionAvailable":true,"label":{"de":"§86 Abs.1 AuslG, a.F., langer Aufenth.i.D.(b.2004)","en":"S.86(1)FA,old v.,entitl.nat.,long-ter.res.(u.2004)","wiki":false},"classKey":null,"compoundKey":null},"ST530":{"definitionAvailable":false,"label":{"de":"Kiribati","en":"Kiribati","wiki":false},"classKey":null,"compoundKey":null},"ST531":{"definitionAvailable":false,"label":{"de":"Nauru","en":"Nauru","wiki":false},"classKey":null,"compoundKey":null},"ST411":{"definitionAvailable":false,"label":{"de":"Hongkong","en":"Hong Kong","wiki":false},"classKey":null,"compoundKey":null},"ST532":{"definitionAvailable":false,"label":{"de":"Vanuatu","en":"Vanuatu","wiki":false},"classKey":null,"compoundKey":null},"ST412":{"definitionAvailable":false,"label":{"de":"Macau","en":"Macau","wiki":false},"classKey":null,"compoundKey":null},"DRITT-EG-09":{"definitionAvailable":false,"label":{"de":"Drittstaaten zu EG-9 (bis 31.12.1980)","en":"EC-9 third countries (until 1980-12-31)","wiki":false},"classKey":null,"compoundKey":null},"ST536":{"definitionAvailable":false,"label":{"de":"Neuseeland","en":"New Zealand","wiki":false},"classKey":null,"compoundKey":null},"DRITT-EG-12":{"definitionAvailable":false,"label":{"de":"Drittstaaten zu EG-12 (bis 31.12.1994)","en":"EC-12 third countries (until 1994-12-31)","wiki":false},"classKey":null,"compoundKey":null},"DRITT-EG-10":{"definitionAvailable":false,"label":{"de":"Drittstaaten zu EG-10 (bis 31.12.1985)","en":"EC-10 third countries (until 1985-12-31)","wiki":false},"classKey":null,"compoundKey":null},"AUSTRALIEN":{"definitionAvailable":false,"label":{"de":"Australien und Ozeanien","en":"Australia and Oceania","wiki":false},"classKey":null,"compoundKey":null}},"rules":{},"contents":{"BEV008":{"label":{"de":"Einbürgerungen von Ausländern","en":"Naturalisation of foreigners","wiki":false},"functions":{"QMU":{"label":{"de":"Anzahl","en":"number","wiki":false},"definitionAvailable":false}},"definitionAvailable":true}},"initialState":{"variableBlocks":{"v6":{"mainAttributes":[{"attribute":"%TOTAL%","childVariable":null,"childAttributes":null,"isHidden":false,"isDocumentary":false},{"attribute":"AMERIKASUD","childVariable":null,"childAttributes":null,"isHidden":false,"isDocumentary":false},{"attribute":"EUROPA-EG-12","childVariable":null,"childAttributes":null,"isHidden":false,"isDocumentary":false},{"attribute":"DRITT-EU-28","childVariable":null,"childAttributes":null,"isHidden":false,"isDocumentary":false},{"attribute":"EUROPA-EG-10","childVariable":null,"childAttributes":null,"isHidden":false,"isDocumentary":false},{"attribute":"DRITT-EU-27","childVariable":null,"childAttributes":null,"isHidden":false,"isDocumentary":false},{"attribute":"LDR-GASTARB","childVariable":null,"childAttributes":null,"isHidden":false,"isDocumentary":false},{"attribute":"DRITT-EWG-06","childVariable":null,"childAttributes":null,"isHidden":false,"isDocumentary":false},{"attribute":"AMERIKANORD","childVariable":null,"childAttributes":null,"isHidden":false,"isDocumentary":false},{"attribute":"EUROPA","childVariable":null,"childAttributes":null,"isHidden":false,"isDocumentary":false},{"attribute":"EUROPA-EU-28","childVariable":null,"childAttributes":null,"isHidden":false,"isDocumentary":false},{"attribute":"EUROPA-EU-27","childVariable":null,"childAttributes":null,"isHidden":false,"isDocumentary":false},{"attribute":"EUROPA-EU-25","childVariable":null,"childAttributes":null,"isHidden":false,"isDocumentary":false},{"attribute":"AFRIKA","childVariable":null,"childAttributes":null,"isHidden":false,"isDocumentary":false},{"attribute":"EUROPA-EG-09","childVariable":null,"childAttributes":null,"isHidden":false,"isDocumentary":false},{"attribute":"DRITT-EU-25","childVariable":null,"childAttributes":null,"isHidden":false,"isDocumentary":false},{"attribute":"LDR-CZ","childVariable":null,"childAttributes":null,"isHidden":false,"isDocumentary":false},{"attribute":"LDR-SU","childVariable":null,"childAttributes":null,"isHidden":false,"isDocumentary":false},{"attribute":"EUROPA-EU-27-1","childVariable":null,"childAttributes":null,"isHidden":false,"isDocumentary":false},{"attribute":"EUROPA-EWG-06","childVariable":null,"childAttributes":null,"isHidden":false,"isDocumentary":false},{"attribute":"AFRIKASUED","childVariable":null,"childAttributes":null,"isHidden":false,"isDocumentary":false},{"attribute":"AMERIKA","childVariable":null,"childAttributes":null,"isHidden":false,"isDocumentary":false},{"attribute":"DRITT-EG-09","childVariable":null,"childAttributes":null,"isHidden":false,"isDocumentary":false},{"attribute":"ASIENVOR","childVariable":null,"childAttributes":null,"isHidden":false,"isDocumentary":false},{"attribute":"DRITT-EU-27-1","childVariable":null,"childAttributes":null,"isHidden":false,"isDocumentary":false},{"attribute":"AFRIKANORD","childVariable":null,"childAttributes":null,"isHidden":false,"isDocumentary":false},{"attribute":"EUROPA-EU-15","childVariable":null,"childAttributes":null,"isHidden":false,"isDocumentary":false},{"attribute":"DRITT-EG-12","childVariable":null,"childAttributes":null,"isHidden":false,"isDocumentary":false},{"attribute":"AFRIKAZENTR","childVariable":null,"childAttributes":null,"isHidden":false,"isDocumentary":false},{"attribute":"AMERIKAMIT2","childVariable":null,"childAttributes":null,"isHidden":false,"isDocumentary":false},{"attribute":"ASIENOST2","childVariable":null,"childAttributes":null,"isHidden":false,"isDocumentary":false},{"attribute":"DRITT-EG-10","childVariable":null,"childAttributes":null,"isHidden":false,"isDocumentary":false},{"attribute":"LDR-SM","childVariable":null,"childAttributes":null,"isHidden":false,"isDocumentary":false},{"attribute":"AFRIKAWEST","childVariable":null,"childAttributes":null,"isHidden":false,"isDocumentary":false},{"attribute":"ASIEN","childVariable":null,"childAttributes":null,"isHidden":false,"isDocumentary":false},{"attribute":"AUSTRALIEN","childVariable":null,"childAttributes":null,"isHidden":false,"isDocumentary":false},{"attribute":"DRITT-EU-15","childVariable":null,"childAttributes":null,"isHidden":false,"isDocumentary":false},{"attribute":"LDR-GB","childVariable":null,"childAttributes":null,"isHidden":false,"isDocumentary":false},{"attribute":"LDR-YU","childVariable":null,"childAttributes":null,"isHidden":false,"isDocumentary":false},{"attribute":"AFRIKAOST","childVariable":null,"childAttributes":null,"isHidden":false,"isDocumentary":false},{"attribute":"ASIENSUED2","childVariable":null,"childAttributes":null,"isHidden":false,"isDocumentary":false}],"mainVariable":"LDRGR1","showVariable":"LIKE_GENESIS","showVariableValue":["LABEL"],"labelOverwrite":{"de":"Ländergruppierungen","en":"Country groups","wiki":false},"idOverwrite":"LDRGR1","sorting":{"direction":"ASC","sortBy":"NONE","sortLanguage":"DE"},"lockSelection":false,"showAsInterline":false,"isHidden":false},"v7":{"mainAttributes":[{"attribute":"GESM","childVariable":null,"childAttributes":null,"isHidden":false,"isDocumentary":false},{"attribute":"GESW","childVariable":null,"childAttributes":null,"isHidden":false,"isDocumentary":false},{"attribute":"%TOTAL%","childVariable":null,"childAttributes":null,"isHidden":false,"isDocumentary":false}],"mainVariable":"GES","showVariable":"LIKE_GENESIS","showVariableValue":["LABEL"],"labelOverwrite":{"de":"Geschlecht","en":"Sex","wiki":false},"idOverwrite":"GES","sorting":{"direction":"ASC","sortBy":"CODE","sortLanguage":"DE"},"lockSelection":false,"showAsInterline":false,"isHidden":false},"v1":{"mainAttributes":[{"attribute":"DG","childVariable":null,"childAttributes":null,"isHidden":false,"isDocumentary":false}],"mainVariable":"DINSG","showVariable":"NONE","showVariableValue":["LABEL"],"labelOverwrite":{"de":"Deutschland insgesamt","en":"Germany","wiki":false},"idOverwrite":"DINSG","sorting":{"direction":"ASC","sortBy":"LABEL","sortLanguage":"DE"},"lockSelection":true,"showAsInterline":false,"isHidden":false},"v2":{"mainAttributes":[{"attribute":"2023","childVariable":null,"childAttributes":null,"isHidden":false,"isDocumentary":false}],"mainVariable":"JAHR","showVariable":"LIKE_GENESIS","showVariableValue":["LABEL"],"labelOverwrite":{"de":"Jahr","en":"Year","wiki":false},"idOverwrite":"JAHR","sorting":{"direction":"ASC","sortBy":"NONE","sortLanguage":"NONE"},"lockSelection":false,"showAsInterline":true,"isHidden":false},"v3":{"mainAttributes":[{"attribute":"EINBUERG01","childVariable":null,"childAttributes":null,"isHidden":false,"isDocumentary":false},{"attribute":"EINBUERG02","childVariable":null,"childAttributes":null,"isHidden":false,"isDocumentary":false}],"mainVariable":"BEVEB1","showVariable":"NONE","showVariableValue":["LABEL"],"labelOverwrite":{"de":"Einbürgerungsart","en":"Type of naturalisation","wiki":false},"idOverwrite":"BEVEB1","sorting":{"direction":"ASC","sortBy":"CODE","sortLanguage":"DE"},"lockSelection":false,"showAsInterline":false,"isHidden":false},"v4":{"mainAttributes":[{"attribute":"RECS-10-1","childVariable":null,"childAttributes":null,"isHidden":false,"isDocumentary":false},{"attribute":"RECS-10-2","childVariable":null,"childAttributes":null,"isHidden":false,"isDocumentary":false},{"attribute":"RECS-8","childVariable":null,"childAttributes":null,"isHidden":false,"isDocumentary":false},{"attribute":"RECS-9","childVariable":null,"childAttributes":null,"isHidden":false,"isDocumentary":false},{"attribute":"RECS-40B","childVariable":null,"childAttributes":null,"isHidden":false,"isDocumentary":false},{"attribute":"RECR-11","childVariable":null,"childAttributes":null,"isHidden":false,"isDocumentary":false},{"attribute":"RECR-12-1","childVariable":null,"childAttributes":null,"isHidden":false,"isDocumentary":false},{"attribute":"RECS-13","childVariable":null,"childAttributes":null,"isHidden":false,"isDocumentary":false},{"attribute":"RECS-14","childVariable":null,"childAttributes":null,"isHidden":false,"isDocumentary":false},{"attribute":"RECS-10-3","childVariable":null,"childAttributes":null,"isHidden":false,"isDocumentary":false},{"attribute":"RECS-10-3-1","childVariable":null,"childAttributes":null,"isHidden":false,"isDocumentary":false},{"attribute":"RECS-10-3-2","childVariable":null,"childAttributes":null,"isHidden":false,"isDocumentary":false},{"attribute":"RECG-116-2-1","childVariable":null,"childAttributes":null,"isHidden":false,"isDocumentary":false},{"attribute":"RECR-9","childVariable":null,"childAttributes":null,"isHidden":false,"isDocumentary":false},{"attribute":"RECH-21","childVariable":null,"childAttributes":null,"isHidden":false,"isDocumentary":false},{"attribute":"RECV-2","childVariable":null,"childAttributes":null,"isHidden":false,"isDocumentary":false},{"attribute":"RECS-40C","childVariable":null,"childAttributes":null,"isHidden":false,"isDocumentary":false},{"attribute":"RECA-85-1","childVariable":null,"childAttributes":null,"isHidden":false,"isDocumentary":false},{"attribute":"RECA-85-2","childVariable":null,"childAttributes":null,"isHidden":false,"isDocumentary":false},{"attribute":"RECA-85ALT","childVariable":null,"childAttributes":null,"isHidden":false,"isDocumentary":false},{"attribute":"RECA-86-1ALT","childVariable":null,"childAttributes":null,"isHidden":false,"isDocumentary":false},{"attribute":"RECA-86-2ALT","childVariable":null,"childAttributes":null,"isHidden":false,"isDocumentary":false},{"attribute":"RECR-8","childVariable":null,"childAttributes":null,"isHidden":false,"isDocumentary":false},{"attribute":"RECR-9-1","childVariable":null,"childAttributes":null,"isHidden":false,"isDocumentary":false},{"attribute":"RECR-9-2","childVariable":null,"childAttributes":null,"isHidden":false,"isDocumentary":false},{"attribute":"RECS-15ALT","childVariable":null,"childAttributes":null,"isHidden":false,"isDocumentary":false},{"attribute":"RECR1-6","childVariable":null,"childAttributes":null,"isHidden":false,"isDocumentary":false},{"attribute":"RECRS-8","childVariable":null,"childAttributes":null,"isHidden":false,"isDocumentary":false},{"attribute":"RECRS-9","childVariable":null,"childAttributes":null,"isHidden":false,"isDocumentary":false},{"attribute":"RECS-16-2","childVariable":null,"childAttributes":null,"isHidden":false,"isDocumentary":false},{"attribute":"RECS-15","childVariable":null,"childAttributes":null,"isHidden":false,"isDocumentary":false},{"attribute":"REC-SONST-ALT","childVariable":null,"childAttributes":null,"isHidden":false,"isDocumentary":false}],"mainVariable":"RECGL1","showVariable":"NONE","showVariableValue":["LABEL"],"labelOverwrite":{"de":"Rechtsgrundlagen","en":"Legal basis","wiki":false},"idOverwrite":"RECGL1","sorting":{"direction":"ASC","sortBy":"NONE","sortLanguage":"DE"},"lockSelection":false,"showAsInterline":false,"isHidden":false},"v5":{"mainAttributes":[{"attribute":"%TOTAL%","childVariable":null,"childAttributes":null,"isHidden":false,"isDocumentary":false},{"attribute":"ST287","childVariable":null,"childAttributes":null,"isHidden":false,"isDocumentary":false},{"attribute":"ST274","childVariable":null,"childAttributes":null,"isHidden":false,"isDocumentary":false},{"attribute":"ST225","childVariable":null,"childAttributes":null,"isHidden":false,"isDocumentary":false},{"attribute":"ST423","childVariable":null,"childAttributes":null,"isHidden":false,"isDocumentary":false},{"attribute":"ST121","childVariable":null,"childAttributes":null,"isHidden":false,"isDocumentary":false},{"attribute":"ST221","childVariable":null,"childAttributes":null,"isHidden":false,"isDocumentary":false},{"attribute":"ST123","childVariable":null,"childAttributes":null,"isHidden":false,"isDocumentary":false},{"attribute":"ST223","childVariable":null,"childAttributes":null,"isHidden":false,"isDocumentary":false},{"attribute":"ST320","childVariable":null,"childAttributes":null,"isHidden":false,"isDocumentary":false},{"attribute":"ST323","childVariable":null,"childAttributes":null,"isHidden":false,"isDocumentary":false},{"attribute":"ST422","childVariable":null,"childAttributes":null,"isHidden":false,"isDocumentary":false},{"attribute":"ST425","childVariable":null,"childAttributes":null,"isHidden":false,"isDocumentary":false},{"attribute":"ST523","childVariable":null,"childAttributes":null,"isHidden":false,"isDocumentary":false},{"attribute":"ST324","childVariable":null,"childAttributes":null,"isHidden":false,"isDocumentary":false},{"attribute":"ST424","childVariable":null,"childAttributes":null,"isHidden":false,"isDocumentary":false},{"attribute":"ST460","childVariable":null,"childAttributes":null,"isHidden":false,"isDocumentary":false},{"attribute":"ST322","childVariable":null,"childAttributes":null,"isHidden":false,"isDocumentary":false},{"attribute":"ST169","childVariable":null,"childAttributes":null,"isHidden":false,"isDocumentary":false},{"attribute":"ST124","childVariable":null,"childAttributes":null,"isHidden":false,"isDocumentary":false},{"attribute":"ST330","childVariable":null,"childAttributes":null,"isHidden":false,"isDocumentary":false},{"attribute":"ST229","childVariable":null,"childAttributes":null,"isHidden":false,"isDocumentary":false},{"attribute":"ST426","childVariable":null,"childAttributes":null,"isHidden":false,"isDocumentary":false},{"attribute":"ST326","childVariable":null,"childAttributes":null,"isHidden":false,"isDocumentary":false},{"attribute":"ST122","childVariable":null,"childAttributes":null,"isHidden":false,"isDocumentary":false},{"attribute":"ST227","childVariable":null,"childAttributes":null,"isHidden":false,"isDocumentary":false},{"attribute":"ST327","childVariable":null,"childAttributes":null,"isHidden":false,"isDocumentary":false},{"attribute":"ST185","childVariable":null,"childAttributes":null,"isHidden":false,"isDocumentary":false},{"attribute":"ST429","childVariable":null,"childAttributes":null,"isHidden":false,"isDocumentary":false},{"attribute":"ST125","childVariable":null,"childAttributes":null,"isHidden":false,"isDocumentary":false},{"attribute":"ST258","childVariable":null,"childAttributes":null,"isHidden":false,"isDocumentary":false},{"attribute":"ST291","childVariable":null,"childAttributes":null,"isHidden":false,"isDocumentary":false},{"attribute":"ST242","childVariable":null,"childAttributes":null,"isHidden":false,"isDocumentary":false},{"attribute":"ST332","childVariable":null,"childAttributes":null,"isHidden":false,"isDocumentary":false},{"attribute":"ST479","childVariable":null,"childAttributes":null,"isHidden":false,"isDocumentary":false},{"attribute":"ST334","childVariable":null,"childAttributes":null,"isHidden":false,"isDocumentary":false},{"attribute":"ST231","childVariable":null,"childAttributes":null,"isHidden":false,"isDocumentary":false},{"attribute":"ST126","childVariable":null,"childAttributes":null,"isHidden":false,"isDocumentary":false},{"attribute":"ST333","childVariable":null,"childAttributes":null,"isHidden":false,"isDocumentary":false},{"attribute":"ST335","childVariable":null,"childAttributes":null,"isHidden":false,"isDocumentary":false},{"attribute":"ST230","childVariable":null,"childAttributes":null,"isHidden":false,"isDocumentary":false},{"attribute":"ST336","childVariable":null,"childAttributes":null,"isHidden":false,"isDocumentary":false},{"attribute":"ST337","childVariable":null,"childAttributes":null,"isHidden":false,"isDocumentary":false},{"attribute":"ST224","childVariable":null,"childAttributes":null,"isHidden":false,"isDocumentary":false},{"attribute":"ST127","childVariable":null,"childAttributes":null,"isHidden":false,"isDocumentary":false},{"attribute":"ST281","childVariable":null,"childAttributes":null,"isHidden":false,"isDocumentary":false},{"attribute":"ST526","childVariable":null,"childAttributes":null,"isHidden":false,"isDocumentary":false},{"attribute":"ST128","childVariable":null,"childAttributes":null,"isHidden":false,"isDocumentary":false},{"attribute":"ST129","childVariable":null,"childAttributes":null,"isHidden":false,"isDocumentary":false},{"attribute":"ST236","childVariable":null,"childAttributes":null,"isHidden":false,"isDocumentary":false},{"attribute":"ST237","childVariable":null,"childAttributes":null,"isHidden":false,"isDocumentary":false},{"attribute":"ST430","childVariable":null,"childAttributes":null,"isHidden":false,"isDocumentary":false},{"attribute":"ST238","childVariable":null,"childAttributes":null,"isHidden":false,"isDocumentary":false},{"attribute":"ST340","childVariable":null,"childAttributes":null,"isHidden":false,"isDocumentary":false},{"attribute":"ST134","childVariable":null,"childAttributes":null,"isHidden":false,"isDocumentary":false},{"attribute":"ST345","childVariable":null,"childAttributes":null,"isHidden":false,"isDocumentary":false},{"attribute":"ST261","childVariable":null,"childAttributes":null,"isHidden":false,"isDocumentary":false},{"attribute":"ST259","childVariable":null,"childAttributes":null,"isHidden":false,"isDocumentary":false},{"attribute":"ST328","childVariable":null,"childAttributes":null,"isHidden":false,"isDocumentary":false},{"attribute":"ST346","childVariable":null,"childAttributes":null,"isHidden":false,"isDocumentary":false},{"attribute":"ST347","childVariable":null,"childAttributes":null,"isHidden":false,"isDocumentary":false},{"attribute":"ST411","childVariable":null,"childAttributes":null,"isHidden":false,"isDocumentary":false},{"attribute":"ST436","childVariable":null,"childAttributes":null,"isHidden":false,"isDocumentary":false},{"attribute":"ST437","childVariable":null,"childAttributes":null,"isHidden":false,"isDocumentary":false},{"attribute":"ST438","childVariable":null,"childAttributes":null,"isHidden":false,"isDocumentary":false},{"attribute":"ST439","childVariable":null,"childAttributes":null,"isHidden":false,"isDocumentary":false},{"attribute":"ST135","childVariable":null,"childAttributes":null,"isHidden":false,"isDocumentary":false},{"attribute":"ST136","childVariable":null,"childAttributes":null,"isHidden":false,"isDocumentary":false},{"attribute":"ST441","childVariable":null,"childAttributes":null,"isHidden":false,"isDocumentary":false},{"attribute":"ST137","childVariable":null,"childAttributes":null,"isHidden":false,"isDocumentary":false},{"attribute":"ST355","childVariable":null,"childAttributes":null,"isHidden":false,"isDocumentary":false},{"attribute":"ST442","childVariable":null,"childAttributes":null,"isHidden":false,"isDocumentary":false},{"attribute":"ST421","childVariable":null,"childAttributes":null,"isHidden":false,"isDocumentary":false},{"attribute":"ST445","childVariable":null,"childAttributes":null,"isHidden":false,"isDocumentary":false},{"attribute":"ST120","childVariable":null,"childAttributes":null,"isHidden":false,"isDocumentary":false},{"attribute":"ST138","childVariable":null,"childAttributes":null,"isHidden":false,"isDocumentary":false},{"attribute":"ST446","childVariable":null,"childAttributes":null,"isHidden":false,"isDocumentary":false},{"attribute":"ST262","childVariable":null,"childAttributes":null,"isHidden":false,"isDocumentary":false},{"attribute":"ST348","childVariable":null,"childAttributes":null,"isHidden":false,"isDocumentary":false},{"attribute":"ST444","childVariable":null,"childAttributes":null,"isHidden":false,"isDocumentary":false},{"attribute":"ST447","childVariable":null,"childAttributes":null,"isHidden":false,"isDocumentary":false},{"attribute":"ST243","childVariable":null,"childAttributes":null,"isHidden":false,"isDocumentary":false},{"attribute":"ST450","childVariable":null,"childAttributes":null,"isHidden":false,"isDocumentary":false},{"attribute":"ST530","childVariable":null,"childAttributes":null,"isHidden":false,"isDocumentary":false},{"attribute":"ST349","childVariable":null,"childAttributes":null,"isHidden":false,"isDocumentary":false},{"attribute":"ST244","childVariable":null,"childAttributes":null,"isHidden":false,"isDocumentary":false},{"attribute":"ST246","childVariable":null,"childAttributes":null,"isHidden":false,"isDocumentary":false},{"attribute":"ST245","childVariable":null,"childAttributes":null,"isHidden":false,"isDocumentary":false},{"attribute":"ST434","childVariable":null,"childAttributes":null,"isHidden":false,"isDocumentary":false},{"attribute":"ST467","childVariable":null,"childAttributes":null,"isHidden":false,"isDocumentary":false},{"attribute":"ST150","childVariable":null,"childAttributes":null,"isHidden":false,"isDocumentary":false},{"attribute":"ST130","childVariable":null,"childAttributes":null,"isHidden":false,"isDocumentary":false},{"attribute":"ST351","childVariable":null,"childAttributes":null,"isHidden":false,"isDocumentary":false},{"attribute":"ST448","childVariable":null,"childAttributes":null,"isHidden":false,"isDocumentary":false},{"attribute":"ST449","childVariable":null,"childAttributes":null,"isHidden":false,"isDocumentary":false},{"attribute":"ST226","childVariable":null,"childAttributes":null,"isHidden":false,"isDocumentary":false},{"attribute":"ST139","childVariable":null,"childAttributes":null,"isHidden":false,"isDocumentary":false},{"attribute":"ST451","childVariable":null,"childAttributes":null,"isHidden":false,"isDocumentary":false},{"attribute":"ST247","childVariable":null,"childAttributes":null,"isHidden":false,"isDocumentary":false},{"attribute":"ST248","childVariable":null,"childAttributes":null,"isHidden":false,"isDocumentary":false},{"attribute":"ST141","childVariable":null,"childAttributes":null,"isHidden":false,"isDocumentary":false},{"attribute":"ST142","childVariable":null,"childAttributes":null,"isHidden":false,"isDocumentary":false},{"attribute":"ST143","childVariable":null,"childAttributes":null,"isHidden":false,"isDocumentary":false},{"attribute":"ST412","childVariable":null,"childAttributes":null,"isHidden":false,"isDocumentary":false},{"attribute":"ST249","childVariable":null,"childAttributes":null,"isHidden":false,"isDocumentary":false},{"attribute":"ST256","childVariable":null,"childAttributes":null,"isHidden":false,"isDocumentary":false},{"attribute":"ST482","childVariable":null,"childAttributes":null,"isHidden":false,"isDocumentary":false},{"attribute":"ST454","childVariable":null,"childAttributes":null,"isHidden":false,"isDocumentary":false},{"attribute":"ST251","childVariable":null,"childAttributes":null,"isHidden":false,"isDocumentary":false},{"attribute":"ST145","childVariable":null,"childAttributes":null,"isHidden":false,"isDocumentary":false},{"attribute":"ST252","childVariable":null,"childAttributes":null,"isHidden":false,"isDocumentary":false},{"attribute":"ST544","childVariable":null,"childAttributes":null,"isHidden":false,"isDocumentary":false},{"attribute":"ST239","childVariable":null,"childAttributes":null,"isHidden":false,"isDocumentary":false},{"attribute":"ST253","childVariable":null,"childAttributes":null,"isHidden":false,"isDocumentary":false},{"attribute":"ST353","childVariable":null,"childAttributes":null,"isHidden":false,"isDocumentary":false},{"attribute":"ST545","childVariable":null,"childAttributes":null,"isHidden":false,"isDocumentary":false},{"attribute":"ST146","childVariable":null,"childAttributes":null,"isHidden":false,"isDocumentary":false},{"attribute":"ST147","childVariable":null,"childAttributes":null,"isHidden":false,"isDocumentary":false},{"attribute":"ST457","childVariable":null,"childAttributes":null,"isHidden":false,"isDocumentary":false},{"attribute":"ST140","childVariable":null,"childAttributes":null,"isHidden":false,"isDocumentary":false},{"attribute":"ST254","childVariable":null,"childAttributes":null,"isHidden":false,"isDocumentary":false},{"attribute":"ST427","childVariable":null,"childAttributes":null,"isHidden":false,"isDocumentary":false},{"attribute":"ST267","childVariable":null,"childAttributes":null,"isHidden":false,"isDocumentary":false},{"attribute":"ST531","childVariable":null,"childAttributes":null,"isHidden":false,"isDocumentary":false},{"attribute":"ST458","childVariable":null,"childAttributes":null,"isHidden":false,"isDocumentary":false},{"attribute":"ST536","childVariable":null,"childAttributes":null,"isHidden":false,"isDocumentary":false},{"attribute":"ST354","childVariable":null,"childAttributes":null,"isHidden":false,"isDocumentary":false},{"attribute":"ST148","childVariable":null,"childAttributes":null,"isHidden":false,"isDocumentary":false},{"attribute":"ST255","childVariable":null,"childAttributes":null,"isHidden":false,"isDocumentary":false},{"attribute":"ST232","childVariable":null,"childAttributes":null,"isHidden":false,"isDocumentary":false},{"attribute":"ST144","childVariable":null,"childAttributes":null,"isHidden":false,"isDocumentary":false},{"attribute":"ST149","childVariable":null,"childAttributes":null,"isHidden":false,"isDocumentary":false},{"attribute":"ST151","childVariable":null,"childAttributes":null,"isHidden":false,"isDocumentary":false},{"attribute":"ST456","childVariable":null,"childAttributes":null,"isHidden":false,"isDocumentary":false},{"attribute":"ST461","childVariable":null,"childAttributes":null,"isHidden":false,"isDocumentary":false},{"attribute":"ST459","childVariable":null,"childAttributes":null,"isHidden":false,"isDocumentary":false},{"attribute":"ST537","childVariable":null,"childAttributes":null,"isHidden":false,"isDocumentary":false},{"attribute":"ST357","childVariable":null,"childAttributes":null,"isHidden":false,"isDocumentary":false},{"attribute":"ST538","childVariable":null,"childAttributes":null,"isHidden":false,"isDocumentary":false},{"attribute":"ST359","childVariable":null,"childAttributes":null,"isHidden":false,"isDocumentary":false},{"attribute":"ST361","childVariable":null,"childAttributes":null,"isHidden":false,"isDocumentary":false},{"attribute":"ST462","childVariable":null,"childAttributes":null,"isHidden":false,"isDocumentary":false},{"attribute":"ST152","childVariable":null,"childAttributes":null,"isHidden":false,"isDocumentary":false},{"attribute":"ST153","childVariable":null,"childAttributes":null,"isHidden":false,"isDocumentary":false},{"attribute":"ST265","childVariable":null,"childAttributes":null,"isHidden":false,"isDocumentary":false},{"attribute":"ST154","childVariable":null,"childAttributes":null,"isHidden":false,"isDocumentary":false},{"attribute":"ST160","childVariable":null,"childAttributes":null,"isHidden":false,"isDocumentary":false},{"attribute":"ST524","childVariable":null,"childAttributes":null,"isHidden":false,"isDocumentary":false},{"attribute":"ST257","childVariable":null,"childAttributes":null,"isHidden":false,"isDocumentary":false},{"attribute":"ST543","childVariable":null,"childAttributes":null,"isHidden":false,"isDocumentary":false},{"attribute":"ST156","childVariable":null,"childAttributes":null,"isHidden":false,"isDocumentary":false},{"attribute":"ST268","childVariable":null,"childAttributes":null,"isHidden":false,"isDocumentary":false},{"attribute":"ST472","childVariable":null,"childAttributes":null,"isHidden":false,"isDocumentary":false},{"attribute":"ST157","childVariable":null,"childAttributes":null,"isHidden":false,"isDocumentary":false},{"attribute":"ST158","childVariable":null,"childAttributes":null,"isHidden":false,"isDocumentary":false},{"attribute":"ST269","childVariable":null,"childAttributes":null,"isHidden":false,"isDocumentary":false},{"attribute":"ST170","childVariable":null,"childAttributes":null,"isHidden":false,"isDocumentary":false},{"attribute":"ST133","childVariable":null,"childAttributes":null,"isHidden":false,"isDocumentary":false},{"attribute":"ST132","childVariable":null,"childAttributes":null,"isHidden":false,"isDocumentary":false},{"attribute":"ST271","childVariable":null,"childAttributes":null,"isHidden":false,"isDocumentary":false},{"attribute":"ST272","childVariable":null,"childAttributes":null,"isHidden":false,"isDocumentary":false},{"attribute":"ST233","childVariable":null,"childAttributes":null,"isHidden":false,"isDocumentary":false},{"attribute":"ST474","childVariable":null,"childAttributes":null,"isHidden":false,"isDocumentary":false},{"attribute":"ST155","childVariable":null,"childAttributes":null,"isHidden":false,"isDocumentary":false},{"attribute":"ST131","childVariable":null,"childAttributes":null,"isHidden":false,"isDocumentary":false},{"attribute":"ST273","childVariable":null,"childAttributes":null,"isHidden":false,"isDocumentary":false},{"attribute":"ST159","childVariable":null,"childAttributes":null,"isHidden":false,"isDocumentary":false},{"attribute":"ST161","childVariable":null,"childAttributes":null,"isHidden":false,"isDocumentary":false},{"attribute":"ST431","childVariable":null,"childAttributes":null,"isHidden":false,"isDocumentary":false},{"attribute":"ST370","childVariable":null,"childAttributes":null,"isHidden":false,"isDocumentary":false},{"attribute":"ST366","childVariable":null,"childAttributes":null,"isHidden":false,"isDocumentary":false},{"attribute":"ST369","childVariable":null,"childAttributes":null,"isHidden":false,"isDocumentary":false},{"attribute":"ST276","childVariable":null,"childAttributes":null,"isHidden":false,"isDocumentary":false},{"attribute":"ST277","childVariable":null,"childAttributes":null,"isHidden":false,"isDocumentary":false},{"attribute":"ST278","childVariable":null,"childAttributes":null,"isHidden":false,"isDocumentary":false},{"attribute":"ST263","childVariable":null,"childAttributes":null,"isHidden":false,"isDocumentary":false},{"attribute":"ST364","childVariable":null,"childAttributes":null,"isHidden":false,"isDocumentary":false},{"attribute":"ST475","childVariable":null,"childAttributes":null,"isHidden":false,"isDocumentary":false},{"attribute":"ST470","childVariable":null,"childAttributes":null,"isHidden":false,"isDocumentary":false},{"attribute":"ST465","childVariable":null,"childAttributes":null,"isHidden":false,"isDocumentary":false},{"attribute":"ST282","childVariable":null,"childAttributes":null,"isHidden":false,"isDocumentary":false},{"attribute":"ST476","childVariable":null,"childAttributes":null,"isHidden":false,"isDocumentary":false},{"attribute":"ST483","childVariable":null,"childAttributes":null,"isHidden":false,"isDocumentary":false},{"attribute":"ST283","childVariable":null,"childAttributes":null,"isHidden":false,"isDocumentary":false},{"attribute":"ST541","childVariable":null,"childAttributes":null,"isHidden":false,"isDocumentary":false},{"attribute":"ST371","childVariable":null,"childAttributes":null,"isHidden":false,"isDocumentary":false},{"attribute":"ST284","childVariable":null,"childAttributes":null,"isHidden":false,"isDocumentary":false},{"attribute":"ST164","childVariable":null,"childAttributes":null,"isHidden":false,"isDocumentary":false},{"attribute":"ST162","childVariable":null,"childAttributes":null,"isHidden":false,"isDocumentary":false},{"attribute":"ST163","childVariable":null,"childAttributes":null,"isHidden":false,"isDocumentary":false},{"attribute":"ST285","childVariable":null,"childAttributes":null,"isHidden":false,"isDocumentary":false},{"attribute":"ST471","childVariable":null,"childAttributes":null,"isHidden":false,"isDocumentary":false},{"attribute":"ST540","childVariable":null,"childAttributes":null,"isHidden":false,"isDocumentary":false},{"attribute":"ST286","childVariable":null,"childAttributes":null,"isHidden":false,"isDocumentary":false},{"attribute":"ST166","childVariable":null,"childAttributes":null,"isHidden":false,"isDocumentary":false},{"attribute":"ST165","childVariable":null,"childAttributes":null,"isHidden":false,"isDocumentary":false},{"attribute":"ST365","childVariable":null,"childAttributes":null,"isHidden":false,"isDocumentary":false},{"attribute":"ST477","childVariable":null,"childAttributes":null,"isHidden":false,"isDocumentary":false},{"attribute":"ST532","childVariable":null,"childAttributes":null,"isHidden":false,"isDocumentary":false},{"attribute":"ST167","childVariable":null,"childAttributes":null,"isHidden":false,"isDocumentary":false},{"attribute":"ST367","childVariable":null,"childAttributes":null,"isHidden":false,"isDocumentary":false},{"attribute":"ST469","childVariable":null,"childAttributes":null,"isHidden":false,"isDocumentary":false},{"attribute":"ST368","childVariable":null,"childAttributes":null,"isHidden":false,"isDocumentary":false},{"attribute":"ST168","childVariable":null,"childAttributes":null,"isHidden":false,"isDocumentary":false},{"attribute":"ST432","childVariable":null,"childAttributes":null,"isHidden":false,"isDocumentary":false},{"attribute":"ST289","childVariable":null,"childAttributes":null,"isHidden":false,"isDocumentary":false},{"attribute":"ST181","childVariable":null,"childAttributes":null,"isHidden":false,"isDocumentary":false},{"attribute":"ST997","childVariable":null,"childAttributes":null,"isHidden":false,"isDocumentary":false},{"attribute":"STAAT900","childVariable":null,"childAttributes":null,"isHidden":false,"isDocumentary":false}],"mainVariable":"STAAG6","showVariable":"LIKE_GENESIS","showVariableValue":["LABEL"],"labelOverwrite":{"de":"Staatsangehörigkeit","en":"Citizenship","wiki":false},"idOverwrite":"STAAG6","sorting":{"direction":"ASC","sortBy":"NONE","sortLanguage":"DE"},"lockSelection":false,"showAsInterline":false,"isHidden":false}},"contentBlocks":{"c1":{"content":"BEV008","functions":["QMU"],"possibleFunctions":[],"functionDecimalDigits":{"QMU":0},"labelOverwrite":{"de":"Einbürgerungen von Ausländern","en":"Naturalisation of foreigners","wiki":false},"idOverwrite":41520,"lockSelection":true,"showAsInterline":false,"isHidden":false}},"statisticBlocks":{"s1":{"statisticCode":"12511","showAsInterline":false,"isHidden":false}},"tableStructure":{"filter":[{"blockCode":"s1","blockType":"STATISTIC","childBlocks":[{"blockCode":"v1","blockType":"VARIABLE","childBlocks":[{"blockCode":"c1","blockType":"CONTENT","childBlocks":[],"possibleBlocks":[]}],"possibleBlocks":[]}],"possibleBlocks":[]}],"colTitle":[{"blockCode":"v3","blockType":"VARIABLE","childBlocks":[{"blockCode":"v4","blockType":"VARIABLE","childBlocks":[],"possibleBlocks":[]}],"possibleBlocks":[]}],"rowTitle":[{"blockCode":"v2","blockType":"VARIABLE","childBlocks":[{"blockCode":"v5","blockType":"VARIABLE","childBlocks":[{"blockCode":"v7","blockType":"VARIABLE","childBlocks":[],"possibleBlocks":[]}],"possibleBlocks":["v5","v6"]}],"possibleBlocks":[]}]},"displayOption":{"showQualityInCells":true,"hideEmptyCols":false,"hideEmptyRows":false,"lockTranspose":false,"lockStructureModification":false,"fixFirstColumn":false}}}